{
  "case_id": "default",
  "corner_angle_deg": 90,
  "parameters": {
    "D": 1200.0,
    "e": 600.0,
    "p": 300.0,
    "t": 0.5,
    "B": 200.0,
    "L_n": 900.0,
    "U_n": 480.0,
    "a": 110.0,
    "w_fly": 60.0,
    "k_c": 0.9,
    "old_tail_scale": 0.8,
    "old_ridge_h": 41.25,
    "young_root_scale": 0.8,
    "young_tip_scale": 0.8,
    "setback": 82.5,
    "likou_width": 55.0,
    "likou_h_regular": 70.0,
    "likou_h_corner_ratio": 2.25,
    "likou_extension_pitches": 1.5,
    "board_lower_t": 20.0,
    "board_upper_t": 13.75,
    "fly_tip_t": 40.0,
    "fly_corner_root_ratio": 0.65,
    "back_join_fraction": 0.7
  },
  "advanced": {
    "purlin_radius_mm": 90.0,
    "qiangshan_width_mm": 90.0,
    "qiangshan_clearance_mm": 20.0,
    "fan_rafter_width_mm": 70.0,
    "fan_rafter_height_mm": 60.0,
    "rafter_seat_relief_mm": 12.0,
    "straight_rafter_width_mm": 70.0,
    "straight_rafter_height_mm": 60.0,
    "old_seat_relief_mm": 25.0,
    "board_surface_overlap_mm": 0.2,
    "likou_surface_overlap_mm": 0.2,
    "flyer_outer_tip_offset_mm": -3.5,
    "flyer_tip_transition_power": 3.0,
    "flyer_contact_tail_gap_mm": 1.0,
    "flyer_seat_delta_mm": 3.0,
    "fan_station_count": 129,
    "flyer_width_fiber_stations": 17,
    "flyer_edge_inboard_bias_mm": 0.05,
    "flyer_tail_search_step_mm": 5.0,
    "flyer_front_edge_search_span_mm": 160.0,
    "flyer_front_edge_coarse_step_mm": 4.0,
    "flyer_tail_root_max_search_mm": 2200.0,
    "flyer_edge_fit_clearance_mm": 0.01,
    "flyer_root_fit_clearance_mm": 0.01,
    "upper_board_surface_overlap_mm": 0.2,
    "combination_back_u_ratio_D": -0.559,
    "combination_front_u_ratio_D": 0.41478875,
    "combination_sagitta_ratio_chord": 0.11794,
    "combination_width_ratio_young_tip": 0.75,
    "combination_cross_width_stations": 7,
    "combination_u_stations": 33,
    "mesh_tessellation_mm": 2.0,
    "mesh_angular_tolerance_rad": 0.35,
    "combination_end_trim_mm": 10.0
  }
}
